<?xml version="1.0" encoding="UTF-8"?><!DOCTYPE definition SYSTEM "dtdprest.dtd"><Prestataires > <Prestataire id="Entreprise_01">	<name> PMO </name> 	<adresse> El khroub - constantine </adresse>	<description> Production machine outils</description></Prestataire><Prestataire id="Entreprise_02"><name> SEACO </name> <adresse> constantine </adresse><description> distribution d'eau</description></Prestataire></Prestataires>